{
  "schemaVersion": "1.0",
  "name": "RSI 다이버전스 롱 (5m)",
  "description": "RSI(14) 30 아래 과매도 → 상승 다이버전스(가격 저점↓·RSI 저점↑) → 봉 마감 RSI 30 위 복귀에 롱. 손절은 최근 20봉 전저점(=다이버전스 저점2), 익절은 손절폭 × 2.5, 48봉(4시간) 안에 안 닫히면 시간 청산. 연구(research/BACKLOG.md DV·EX2): 수수료 전 거래당 약 +1.2bp, 익절로 끝나는 비율 약 20% — taker 왕복 10bp 를 못 넘는다.",
  "market": {
    "exchange": "binance-futures",
    "symbol": "BTCUSDT",
    "timeframe": "5m",
    "direction": "long"
  },
  "entry": {
    "left": {
      "indicator": "RSI_DIV",
      "period": 14,
      "params": {
        "level": 30,
        "min_gap": 5,
        "window": 60
      }
    },
    "cmp": ">",
    "right": 0
  },
  "exit": {
    "stopLoss": {
      "type": "swing",
      "lookback": 20,
      "bufferPercent": 0
    },
    "takeProfit": {
      "type": "riskReward",
      "value": 2.5
    },
    "timeStop": {
      "maxBars": 48
    }
  },
  "sizing": {
    "leverage": 10,
    "marginMode": "isolated",
    "size": {
      "type": "equityPercent",
      "value": 10.0
    },
    "maxConcurrentPositions": 1
  },
  "filter": {
    "cooldownBars": 0,
    "avoidFundingWindowMinutes": 2
  }
}
